{
  "$schema": "../schema/rules.schema.json",
  "file_kind": "rules",
  "version": "2026.10.0",
  "status": "draft",
  "licence": "CC-BY-4.0",
  "attribution": "Margdarshak content pack, team Chanakya (Nestiq Private Limited), 2026",
  "notes": "Status as of 2026-10-23 per DEBRIEF_SPEC §3: every entry is verified=false (practice rows 'review pending', law/evidence rows 'no', the medical row 'no (draft)'), so no rule is AI-citable yet and the DebriefAgent cites UNKNOWN. Flip verified only after the primary text is fetched and a second person checks the wording (CURRICULUM §5); then regenerate content/generated/allowlists.json.",
  "as_of": "2026-10-23",
  "rules": [
    {
      "rule_id": "RR-SPD-001",
      "kind": "practice",
      "text_en": "Ride at a speed you can stop from within the distance you can see to be clear",
      "text_hi": "उतनी ही रफ़्तार रखें जिस पर आप साफ़ दिख रही दूरी के भीतर रुक सकें।",
      "source_title": "Stopping-distance physics (CURRICULUM M1; research 02 M1)",
      "source_url": null,
      "verified_on": null,
      "verified": false,
      "reviewed_by": [],
      "ai_citable": false,
      "verification_status": "review_pending",
      "source_pin": "not_applicable",
      "source_note": "Team practice statement from the curriculum. Status 'review pending': two-person review (CURRICULUM §5) flips it to verified; until then it is not AI-citable.",
      "module_ids": ["M1", "M8", "M16"],
      "hi_review_status": "pending_native_review"
    },
    {
      "rule_id": "RR-SPD-002",
      "kind": "law",
      "text_en": "Obey posted speed limits",
      "text_hi": "लगाई गई गति-सीमा का पालन करें।",
      "source_title": "Motor Vehicles Act 1988 as amended (speed-limit provisions; section to pin)",
      "source_url": "https://www.indiacode.nic.in",
      "verified_on": null,
      "verified": false,
      "reviewed_by": [],
      "ai_citable": false,
      "verification_status": "not_verified",
      "source_pin": "to_pin",
      "source_note": "Section number not pinned. India Code is the cited host for the Act (CURRICULUM §2.0); the section must be fetched and checked by a second person before verified flips.",
      "module_ids": ["M1", "LL2"],
      "hi_review_status": "pending_native_review"
    },
    {
      "rule_id": "RR-SPD-003",
      "kind": "evidence",
      "text_en": "Pedestrian death risk is under 20% below 50 km/h and about 60% at 80 km/h",
      "text_hi": "50 किमी/घंटा से कम रफ़्तार पर पैदल यात्री की मृत्यु का जोखिम 20% से कम और 80 किमी/घंटा पर लगभग 60% होता है।",
      "source_title": "WHO road traffic injuries fact sheet (not re-fetched)",
      "source_url": "https://www.who.int/news-room/fact-sheets/detail/road-traffic-injuries",
      "verified_on": null,
      "verified": false,
      "reviewed_by": [],
      "ai_citable": false,
      "verification_status": "not_verified",
      "source_pin": "to_pin",
      "source_note": "Not re-fetched since research (CURRICULUM M2 open item). Only the two published reference points may be used; no invented curve. Evidence text for cited 'why this matters' cards only.",
      "module_ids": ["M2"],
      "hi_review_status": "pending_native_review"
    },
    {
      "rule_id": "RR-HLM-001",
      "kind": "law",
      "text_en": "Rider and pillion must wear a protective helmet",
      "text_hi": "चलाने वाले और पीछे बैठी सवारी, दोनों को सुरक्षात्मक हेलमेट पहनना ज़रूरी है।",
      "source_title": "Motor Vehicles Act 1988 s.129 (not re-fetched)",
      "source_url": "https://www.indiacode.nic.in",
      "verified_on": null,
      "verified": false,
      "reviewed_by": [],
      "ai_citable": false,
      "verification_status": "not_verified",
      "source_pin": "to_pin",
      "source_note": "s.129 text and its exemptions not re-fetched (CURRICULUM M3 legal review).",
      "module_ids": ["M3", "M13", "LL2"],
      "hi_review_status": "pending_native_review"
    },
    {
      "rule_id": "RR-HLM-002",
      "kind": "evidence",
      "text_en": "Look for the ISI mark (IS 4151) on helmets",
      "text_hi": "हेलमेट पर ISI मार्क (IS 4151) देखें।",
      "source_title": "Bureau of Indian Standards, IS 4151 protective helmets (reference to pin)",
      "source_url": null,
      "verified_on": null,
      "verified": false,
      "reviewed_by": [],
      "ai_citable": false,
      "verification_status": "not_verified",
      "source_pin": "to_pin",
      "source_note": "BIS standard reference and URL not pinned (CURRICULUM M3).",
      "module_ids": ["M3"],
      "hi_review_status": "pending_native_review"
    },
    {
      "rule_id": "RR-HLM-003",
      "kind": "practice",
      "text_en": "Fasten the strap; two fingers fit under it; the helmet shouldn't rock",
      "text_hi": "स्ट्रैप बाँधें; उसके नीचे दो उँगलियाँ आएँ; हेलमेट हिलना नहीं चाहिए।",
      "source_title": "PMC6182975 (helmet fastening study); CURRICULUM M3",
      "source_url": "https://pmc.ncbi.nlm.nih.gov/articles/PMC6182975",
      "verified_on": null,
      "verified": false,
      "reviewed_by": [],
      "ai_citable": false,
      "verification_status": "review_pending",
      "source_pin": "pinned",
      "source_note": "Team practice statement from the curriculum. Status 'review pending': two-person review (CURRICULUM §5) flips it to verified; until then it is not AI-citable.",
      "module_ids": ["M3"],
      "hi_review_status": "pending_native_review"
    },
    {
      "rule_id": "RR-HVY-001",
      "kind": "practice",
      "text_en": "Stay out of a truck's or bus's no-zones; if you can't see the driver in the mirror, he can't see you",
      "text_hi": "ट्रक या बस के नो-ज़ोन से दूर रहें; अगर आपको शीशे में ड्राइवर नहीं दिखता, तो वह भी आपको नहीं देख सकता।",
      "source_title": "CURRICULUM M4 (no-zones; RAI23 T4.5 rationale)",
      "source_url": null,
      "verified_on": null,
      "verified": false,
      "reviewed_by": [],
      "ai_citable": false,
      "verification_status": "review_pending",
      "source_pin": "not_applicable",
      "source_note": "Team practice statement from the curriculum. Status 'review pending': two-person review (CURRICULUM §5) flips it to verified; until then it is not AI-citable.",
      "module_ids": ["M4"],
      "hi_review_status": "pending_native_review"
    },
    {
      "rule_id": "RR-HVY-002",
      "kind": "law",
      "text_en": "Overtake only on the right",
      "text_hi": "ओवरटेक सिर्फ़ दाईं ओर से करें।",
      "source_title": "Motor Vehicles (Driving) Regulations 2017 (regulation no. to pin)",
      "source_url": null,
      "verified_on": null,
      "verified": false,
      "reviewed_by": [],
      "ai_citable": false,
      "verification_status": "not_verified",
      "source_pin": "to_pin",
      "source_note": "Gazette text of the MV (Driving) Regulations 2017 not fetched (CURRICULUM §2.0 open item). When pinning, check the regulation's wording and any exception (for example a vehicle ahead that has signalled and moved over to turn right) before this text is approved.",
      "module_ids": ["LL2", "M4", "M5"],
      "hi_review_status": "pending_native_review"
    },
    {
      "rule_id": "RR-HVY-003",
      "kind": "practice",
      "text_en": "When a large vehicle indicates or turns left, hold back behind it",
      "text_hi": "जब कोई बड़ा वाहन बायाँ इंडिकेटर दे या बाएँ मुड़े, तो उसके पीछे रुके रहें।",
      "source_title": "CURRICULUM M4/M5",
      "source_url": null,
      "verified_on": null,
      "verified": false,
      "reviewed_by": [],
      "ai_citable": false,
      "verification_status": "review_pending",
      "source_pin": "not_applicable",
      "source_note": "Team practice statement from the curriculum. Status 'review pending': two-person review (CURRICULUM §5) flips it to verified; until then it is not AI-citable.",
      "module_ids": ["M4", "M5"],
      "hi_review_status": "pending_native_review"
    },
    {
      "rule_id": "RR-JCT-001",
      "kind": "practice",
      "text_en": "At junctions: slow, look right, left and right again, creep to see, then go",
      "text_hi": "चौराहे पर: धीमे हों, दाएँ, बाएँ और फिर से दाएँ देखें, धीरे-धीरे आगे बढ़कर देखें, फिर जाएँ।",
      "source_title": "CURRICULUM M6",
      "source_url": null,
      "verified_on": null,
      "verified": false,
      "reviewed_by": [],
      "ai_citable": false,
      "verification_status": "review_pending",
      "source_pin": "not_applicable",
      "source_note": "Team practice statement from the curriculum. Status 'review pending': two-person review (CURRICULUM §5) flips it to verified; until then it is not AI-citable.",
      "module_ids": ["M6"],
      "hi_review_status": "pending_native_review"
    },
    {
      "rule_id": "RR-JCT-002",
      "kind": "law",
      "text_en": "Give way to pedestrians on a crossing and to traffic already in the junction",
      "text_hi": "क्रॉसिंग पर पैदल यात्रियों को और चौराहे में पहले से मौजूद वाहनों को रास्ता दें।",
      "source_title": "Motor Vehicles (Driving) Regulations 2017 (to pin)",
      "source_url": null,
      "verified_on": null,
      "verified": false,
      "reviewed_by": [],
      "ai_citable": false,
      "verification_status": "not_verified",
      "source_pin": "to_pin",
      "source_note": "MVDR 2017 gazette text not fetched; regulation numbers to pin.",
      "module_ids": ["LL2", "M6", "M18"],
      "hi_review_status": "pending_native_review"
    },
    {
      "rule_id": "RR-FOL-001",
      "kind": "practice",
      "text_en": "Keep at least a 3-second gap; 4 or more in wet or at night",
      "text_hi": "आगे वाले वाहन से कम से कम 3 सेकंड का फ़ासला रखें; गीली सड़क पर या रात में 4 सेकंड या उससे ज़्यादा।",
      "source_title": "CURRICULUM M7",
      "source_url": null,
      "verified_on": null,
      "verified": false,
      "reviewed_by": [],
      "ai_citable": false,
      "verification_status": "review_pending",
      "source_pin": "not_applicable",